{
  "schema_version": "1.0",
  "review": {
    "id": "REV-FIXTURE-001",
    "target_revision": "synthetic-fixture@package",
    "generated_at": "2026-08-07T15:00:00Z",
    "authorization": {
      "owner_or_authorizer": "lzr1-skills package maintainer; synthetic fixture only",
      "allowed_actions": [
        "read",
        "local-static-analysis"
      ],
      "environment": "local",
      "constraints": [
        "Do not execute, import, deploy, or pass real data to the fixture"
      ]
    },
    "scope": {
      "included": [
        "tests/fixtures/vulnerable_sample.py"
      ],
      "excluded": []
    },
    "coverage": {
      "reviewed": 1,
      "mechanically_inventoried": 0,
      "generated": 0,
      "vendored": 0,
      "binary_or_opaque": 0,
      "inaccessible": 0,
      "excluded": 0,
      "not_applicable": 0
    },
    "source_freshness": [
      {
        "source": "OWASP Application Security Verification Standard 5.0.0",
        "retrieved_at": "2026-08-07T15:00:00Z",
        "url": "https://owasp.org/www-project-application-security-verification-standard/"
      },
      {
        "source": "OWASP API Security Top 10 2023",
        "retrieved_at": "2026-08-07T15:00:00Z",
        "url": "https://owasp.org/API-Security/editions/2023/en/0x00-header/"
      },
      {
        "source": "MITRE CWE",
        "retrieved_at": "2026-08-07T15:00:00Z",
        "url": "https://cwe.mitre.org/"
      },
      {
        "source": "OWASP Top 10 for LLM Applications 2025",
        "retrieved_at": "2026-08-07T15:00:00Z",
        "url": "https://genai.owasp.org/llm-top-10/"
      }
    ]
  },
  "findings": [
    {
      "id": "SR-FIXTURE-AUTHZ",
      "title": "Tenant context is accepted without an authorization decision",
      "status": "confirmed",
      "asset": "Synthetic tenant record",
      "locations": [
        {
          "path": "tests/fixtures/vulnerable_sample.py",
          "line_start": 12,
          "line_end": 14,
          "symbol": "load_tenant_record",
          "artifact_digest": null,
          "unavailable_reason": null
        }
      ],
      "evidence": [
        {
          "type": "code-excerpt",
          "summary": "The function receives requested_tenant but returns record without comparing tenant or principal context.",
          "redacted": false,
          "reference": "tests/fixtures/vulnerable_sample.py:12-14",
          "digest": null
        }
      ],
      "reasoning": {
        "model": "authorization-decision",
        "narrative": "The requested tenant is caller-controlled, but no principal, resource ownership, or policy decision constrains the returned object.",
        "steps": [
          "Caller supplies requested_tenant and a record",
          "No authenticated principal or tenant ownership is evaluated",
          "The record is returned regardless of tenant context"
        ]
      },
      "preconditions": [
        "The function is reachable with a record belonging to another tenant",
        "No upstream authorization control exists outside the fixture"
      ],
      "impact": {
        "dimensions": [
          "confidentiality",
          "privacy"
        ],
        "narrative": "A real implementation with this invariant failure could disclose another tenant's record. This fixture does not contain real data."
      },
      "taxonomy": {
        "cwe": [
          "CWE-862"
        ],
        "capec": [],
        "attack": []
      },
      "confidence": {
        "level": "high",
        "rationale": "The synthetic fixture deliberately omits any authorization branch and documents that omission.",
        "uncertainties": [
          "A production caller could enforce authorization before invoking this function"
        ]
      },
      "cvss_v4": null,
      "live_context": [],
      "remediation": {
        "recommendation": "Require the authenticated principal and resource tenant, then deny unless an explicit centralized policy permits the action.",
        "alternatives": [
          "Replace the function with a repository method that derives tenant scope from the authenticated session rather than caller input"
        ],
        "compatibility": "Callers must provide authenticated identity context and handle authorization denial.",
        "rollout": "Add negative cross-tenant tests before changing the interface, then deploy behind monitoring.",
        "rollback": "Revert the interface change only if the prior access path is disabled by an equivalent policy control."
      },
      "validation": {
        "method": "Static negative-case inspection of the synthetic fixture",
        "expected": "No branch validates principal, action, resource, or tenant before return",
        "performed": true,
        "result": "passed",
        "evidence": [
          "tests/fixtures/vulnerable_sample.py:12-14"
        ]
      },
      "residual_risk": {
        "summary": "Upstream authorization remains an unknown outside this isolated fixture.",
        "owner": "fixture maintainer",
        "review_by": "2027-08-07"
      },
      "conflicts": []
    },
    {
      "id": "SR-FIXTURE-SQL",
      "title": "Untrusted user name is concatenated into a SQL statement",
      "status": "confirmed",
      "asset": "Synthetic user query",
      "locations": [
        {
          "path": "tests/fixtures/vulnerable_sample.py",
          "line_start": 17,
          "line_end": 19,
          "symbol": "build_user_query",
          "artifact_digest": null,
          "unavailable_reason": null
        }
      ],
      "evidence": [
        {
          "type": "code-excerpt",
          "summary": "The user_name parameter is concatenated directly between SQL quote characters.",
          "redacted": false,
          "reference": "tests/fixtures/vulnerable_sample.py:17-19",
          "digest": null
        }
      ],
      "reasoning": {
        "model": "source-to-sink",
        "narrative": "Caller-controlled text is inserted into query syntax without a parameter-binding boundary.",
        "steps": [
          "Caller controls user_name",
          "String concatenation places user_name inside SQL syntax",
          "A downstream database execution sink would interpret injected syntax"
        ]
      },
      "preconditions": [
        "A caller controls user_name",
        "A downstream component executes the returned string as SQL"
      ],
      "impact": {
        "dimensions": [
          "confidentiality",
          "integrity"
        ],
        "narrative": "A real caller that executes this string could expose or modify database records. The fixture does not connect to a database."
      },
      "taxonomy": {
        "cwe": [
          "CWE-89"
        ],
        "capec": [
          "CAPEC-66"
        ],
        "attack": []
      },
      "confidence": {
        "level": "high",
        "rationale": "The data-to-query-syntax path is explicit in the synthetic function.",
        "uncertainties": [
          "The fixture does not include a downstream execution call"
        ]
      },
      "cvss_v4": null,
      "live_context": [],
      "remediation": {
        "recommendation": "Return a parameterized query and values separately, or use a data-access API that binds parameters.",
        "alternatives": [
          "Replace free-form lookup with an allowlisted identifier type"
        ],
        "compatibility": "The database caller must support parameter binding.",
        "rollout": "Add injection-oriented negative tests and migrate each call site to bound parameters.",
        "rollback": "Retain the prior query only in a disabled test fixture; do not restore concatenation in runtime code."
      },
      "validation": {
        "method": "Static source-to-sink inspection",
        "expected": "Input is concatenated into SQL syntax without a binding boundary",
        "performed": true,
        "result": "passed",
        "evidence": [
          "tests/fixtures/vulnerable_sample.py:19"
        ]
      },
      "residual_risk": {
        "summary": "Other dynamic query builders would require separate coverage.",
        "owner": "fixture maintainer",
        "review_by": "2027-08-07"
      },
      "conflicts": []
    },
    {
      "id": "SR-FIXTURE-SHELL",
      "title": "Caller-controlled command reaches a shell interpreter",
      "status": "confirmed",
      "asset": "Synthetic local process authority",
      "locations": [
        {
          "path": "tests/fixtures/vulnerable_sample.py",
          "line_start": 22,
          "line_end": 24,
          "symbol": "unsafe_shell",
          "artifact_digest": null,
          "unavailable_reason": null
        }
      ],
      "evidence": [
        {
          "type": "code-excerpt",
          "summary": "The command parameter is passed directly to os.system.",
          "redacted": false,
          "reference": "tests/fixtures/vulnerable_sample.py:22-24",
          "digest": null
        }
      ],
      "reasoning": {
        "model": "source-to-sink",
        "narrative": "A caller-controlled string crosses directly into a shell interpreter with the process's authority.",
        "steps": [
          "Caller controls command",
          "No allowlist or structured argument boundary is applied",
          "os.system delegates the string to a shell"
        ]
      },
      "preconditions": [
        "An attacker influences command",
        "A real application invokes the function"
      ],
      "impact": {
        "dimensions": [
          "confidentiality",
          "integrity",
          "availability"
        ],
        "narrative": "A real invocation could execute commands with the application's privileges. This fixture is never executed by package tests."
      },
      "taxonomy": {
        "cwe": [
          "CWE-78"
        ],
        "capec": [
          "CAPEC-88"
        ],
        "attack": []
      },
      "confidence": {
        "level": "high",